{
  "schemaVersion": 1,
  "id": "edo-unf3",
  "product": "Сопоставление номенклатуры ЭДО в УНФ 3.0",
  "brand": {
    "name": "Кодобаза · ЭДО",
    "accent": "#7352c7"
  },
  "footer": "Расширение для УНФ 3.0 · codebaza.ru",
  "voice": {
    "name": "Zapis",
    "rate": 0,
    "gainDb": 0
  },
  "scenes": [
    {
      "id": "pain",
      "seconds": 8,
      "kicker": "ЗНАКОМАЯ СИТУАЦИЯ",
      "title": "Товары из УПД\nне находятся в вашей базе?",
      "body": "Поставщик использует свои названия, коды и артикулы.",
      "image": "assets/edo/02.png",
      "narration": "Коды и названия поставщика отличаются от вашей базы. Позиции УПД не сопоставляются.",
      "type": "screenshot",
      "imageCaption": "Реальный экран расширения из авторской публикации на Инфостарте",
      "evidence": [
        "Публикация автора: https://infostart.ru/marketplace/2354100/"
      ]
    },
    {
      "id": "workflow",
      "type": "flow",
      "seconds": 8,
      "kicker": "ПОНЯТНЫЙ ПРОЦЕСС",
      "title": "От строк поставщика\nк вашим товарам",
      "body": "Настройте правила, проверьте найденные позиции и перенесите результат.",
      "narration": "Настройте сравнение, найдите нужные товары и проверьте результат перед переносом в ЭДО.",
      "nodes": [
        "Строки УПД",
        "Правила поиска",
        "Результаты",
        "Форма ЭДО"
      ],
      "revealAt": [
        0.4,
        1.7,
        3.0,
        4.3
      ],
      "evidence": [
        "Схема этапов расширения из авторской публикации: https://infostart.ru/marketplace/2354100/"
      ]
    },
    {
      "id": "rules",
      "seconds": 12,
      "kicker": "ПРАВИЛА ВАШЕГО ПОСТАВЩИКА",
      "title": "Выберите, какие поля\nсравнивать",
      "body": "Код, артикул, наименование или дополнительный реквизит.",
      "image": "assets/edo/01.png",
      "narration": "Сравните свой артикул с кодом поставщика. Настройте замены и очистку строк.",
      "type": "screenshot",
      "imageCaption": "Реальный экран расширения из авторской публикации на Инфостарте",
      "evidence": [
        "Публикация автора: https://infostart.ru/marketplace/2354100/"
      ]
    },
    {
      "id": "example",
      "seconds": 10,
      "kicker": "ПРИМЕР НОРМАЛИЗАЦИИ",
      "title": "Лишние пробелы\nне мешают сравнению",
      "body": "Отдельные настройки для ваших данных и данных поставщика.",
      "narration": "Названия отличаются пробелами. Удалите их при сравнении. Сами товары в справочнике не переименовываются.",
      "type": "compare",
      "cards": [
        {
          "label": "У ПОСТАВЩИКА",
          "value": "Винт М 6х20"
        },
        {
          "label": "В ВАШЕЙ БАЗЕ",
          "value": "ВинтМ6х20"
        }
      ],
      "disclosure": "Схема сравнения строк. Не запись результата в базе.",
      "evidence": [
        "Публикация автора: https://infostart.ru/marketplace/2354100/",
        "Иллюстративный пример нормализации строк, вынесенный отдельно от интерфейса."
      ]
    },
    {
      "id": "result",
      "seconds": 10,
      "kicker": "МАССОВЫЙ ПОДБОР",
      "title": "Найдите соответствия\nдля всей таблицы",
      "body": "Проверьте найденные позиции и перенесите результат в форму ЭДО.",
      "image": "assets/edo/01.png",
      "narration": "Найдите соответствия одним запросом по всей таблице. Проверьте и перенесите результат в ЭДО. Настройки сохраняются.",
      "type": "screenshot",
      "imageCaption": "Реальный экран расширения из авторской публикации на Инфостарте",
      "evidence": [
        "Публикация автора: https://infostart.ru/marketplace/2354100/"
      ]
    },
    {
      "id": "cta",
      "seconds": 6,
      "kicker": "РАСШИРЕНИЕ ДЛЯ УНФ 3.0",
      "title": "Настройте сопоставление\nпод своих поставщиков",
      "body": "10 000 ₽ · При покупке 1 час доработки бесплатно",
      "narration": "Для УНФ три ноль. Десять тысяч рублей. Заявка автору на Кодобазе.",
      "type": "cta",
      "button": "Получить расширение",
      "contact": "codebaza.ru",
      "evidence": [
        "Публикация автора: https://infostart.ru/marketplace/2354100/",
        "Цена 10 000 ₽ и 1 час доработки при покупке указаны автором в каталоге Кодобазы."
      ]
    }
  ]
}
