{
  "schemaVersion": 1,
  "id": "edo-recording",
  "product": "ЭДО: короткий пример для записи",
  "brand": {
    "name": "Кодобаза · ЭДО",
    "accent": "#7352c7"
  },
  "footer": "Расширение для УНФ 3.0 · codebaza.ru",
  "voice": {
    "name": "Zapis",
    "rate": 0,
    "gainDb": 0
  },
  "scenes": [
    {
      "id": "pain",
      "seconds": 6,
      "kicker": "ЗНАКОМАЯ СИТУАЦИЯ",
      "title": "Товары из УПД\nне находятся в вашей базе?",
      "body": "Поставщик использует свои названия, коды и артикулы.",
      "image": "assets/edo/02.png",
      "narration": "Названия поставщика отличаются от вашей базы. Найдём нужные товары.",
      "type": "screenshot",
      "imageCaption": "Реальный экран расширения из авторской публикации на Инфостарте",
      "evidence": [
        "Публикация автора: https://infostart.ru/marketplace/2354100/"
      ]
    },
    {
      "id": "workflow",
      "type": "flow",
      "seconds": 6,
      "kicker": "ПОНЯТНЫЙ ПРОЦЕСС",
      "title": "От строк поставщика\nк вашим товарам",
      "body": "Настройте правила, проверьте найденные позиции и перенесите результат.",
      "narration": "Выберите правила, найдите товары и проверьте результат.",
      "nodes": [
        "Строки УПД",
        "Правила поиска",
        "Результаты",
        "Форма ЭДО"
      ],
      "revealAt": [
        0.3,
        1.3,
        2.3,
        3.3
      ],
      "evidence": [
        "Схема этапов расширения из авторской публикации: https://infostart.ru/marketplace/2354100/"
      ]
    },
    {
      "id": "cta",
      "seconds": 5,
      "kicker": "РАСШИРЕНИЕ ДЛЯ УНФ 3.0",
      "title": "Настройте сопоставление\nпод своих поставщиков",
      "body": "10 000 ₽ · При покупке 1 час доработки бесплатно",
      "narration": "Посмотрите описание расширения на Кодобазе.",
      "type": "cta",
      "button": "Получить расширение",
      "contact": "codebaza.ru",
      "evidence": [
        "Публикация автора: https://infostart.ru/marketplace/2354100/",
        "Цена 10 000 ₽ и 1 час доработки при покупке указаны автором в каталоге Кодобазы."
      ]
    }
  ]
}
