{
  "schemaVersion": 1,
  "id": "motion-showcase",
  "product": "Zapis: анимация из сценария",
  "canvas": "paper",
  "brand": {
    "name": "Zapis · Видео",
    "accent": "#08765e"
  },
  "footer": "Анимированный пример возможностей генератора",
  "voice": {
    "name": "Zapis",
    "rate": 0,
    "gainDb": 0
  },
  "scenes": [
    {
      "id": "headline",
      "type": "title",
      "seconds": 6,
      "kicker": "ПОВТОРЯЕМЫЙ ПРОЦЕСС",
      "title": "Маркетинговый ролик\nиз обычного сценария",
      "body": "Меняйте текст и материалы, затем собирайте новый вариант.",
      "narration": "Три этапа: подготовить сценарий, проверить кадры и собрать ролик.",
      "metric": {
        "value": 3,
        "label": "этапа от сценария до ролика"
      },
      "evidence": [
        "Во вкладке «Видео» можно отредактировать сценарий, проверить раскадровку и собрать MP4."
      ]
    },
    {
      "id": "pipeline",
      "type": "flow",
      "seconds": 7,
      "kicker": "СХЕМА В ДВИЖЕНИИ",
      "title": "Каждый шаг\nпоявляется вовремя",
      "body": "Узлы, линии и текст анимируются по кадрам.",
      "narration": "Сценарий задаёт содержание, кадры показывают продукт, голос объясняет, и всё собирается в видео.",
      "nodes": [
        "Сценарий",
        "Кадры",
        "Голос",
        "MP4"
      ],
      "revealAt": [
        0.3,
        1.5,
        2.7,
        3.9
      ],
      "evidence": [
        "Схема повторяет шаги scripts/pipeline.mjs. Это иллюстрация работы генератора."
      ]
    },
    {
      "id": "finish",
      "type": "cta",
      "seconds": 5,
      "kicker": "ВАШИ МАТЕРИАЛЫ",
      "title": "Настройте шаблон\nпод свой продукт",
      "body": "Горизонтальные и вертикальные версии, голос и субтитры.",
      "narration": "Откройте готовый пример, измените его и соберите свой ролик.",
      "button": "Повторить процесс",
      "contact": "Zapis · Видео",
      "evidence": [
        "Оба формата, озвучка и субтитры проверяются в примере проекта."
      ]
    }
  ]
}
